{
    "owner": "NitashEU",
    "repo": "zed.gg",
    "language": "TypeScript",
    "links": [
        {
            "name": "npm",
            "url": "https://www.npmjs.com/package/zed.gg"
        }
    ],
    "metadata": {
        "v3": "true",
        "rate-limiter": {
            "per-region": true,
            "burst": false,
            "spread": true,
            "header-validation": true
        }
    }
}
